{
  "$schema": "https://json-schema.org/draft/2020-12/schema",
  "$id": "phase-1-job-envelope",
  "title": "AetherMesh Phase 1 local job envelope",
  "description": "A file-friendly, local-only description of one runnable job. References are relative local paths; payloads are not embedded.",
  "type": "object",
  "additionalProperties": false,
  "required": [
    "job_id",
    "schema_version",
    "creator_node_id",
    "created_at",
    "job_type",
    "input_manifest",
    "expected_outputs",
    "validation_requirements",
    "lineage",
    "contribution"
  ],
  "properties": {
    "job_id": {"type": "string", "pattern": "^(?:[a-z0-9][a-z0-9-]{0,127}|sha256:[0-9a-f]{64})$"},
    "schema_version": {"const": 1},
    "creator_node_id": {"type": "string", "minLength": 1},
    "created_at": {"type": "string", "format": "date-time"},
    "job_type": {"type": "string", "minLength": 1},
    "input_manifest": {
      "type": "object",
      "additionalProperties": false,
      "required": ["files"],
      "properties": {
        "files": {
          "type": "array",
          "minItems": 1,
          "items": {
            "type": "object",
            "additionalProperties": false,
            "required": ["path", "sha256", "size_bytes"],
            "properties": {
              "path": {"type": "string", "pattern": "^(?!/)(?![A-Za-z]:)(?!.*://)(?!.*\\\\)(?!\\.?\\.?(?:/|$))(?!.*(?:/\\.?\\.?)(?:/|$))[^/]+(?:/[^/]+)*$"},
              "sha256": {"type": "string", "pattern": "^sha256:[0-9a-f]{64}$"},
              "size_bytes": {"type": "integer", "minimum": 0},
              "metadata": {"type": "object"}
            }
          }
        }
      }
    },
    "expected_outputs": {
      "type": "object",
      "additionalProperties": false,
      "required": ["artifacts"],
      "properties": {
        "artifacts": {
          "type": "array",
          "minItems": 1,
          "items": {
            "type": "object",
            "additionalProperties": false,
            "required": ["path", "media_type"],
            "properties": {
              "path": {"type": "string", "pattern": "^(?!/)(?![A-Za-z]:)(?!.*://)(?!.*\\\\)(?!\\.?\\.?(?:/|$))(?!.*(?:/\\.?\\.?)(?:/|$))[^/]+(?:/[^/]+)*$"},
              "media_type": {"type": "string", "minLength": 1}
            }
          }
        }
      }
    },
    "validation_requirements": {
      "type": "object",
      "additionalProperties": false,
      "required": ["checks"],
      "properties": {
        "checks": {
          "type": "array",
          "minItems": 1,
          "items": {
            "type": "object",
            "additionalProperties": false,
            "required": ["check_id", "receipt_path", "pass_criteria"],
            "properties": {
              "check_id": {"type": "string", "minLength": 1},
              "receipt_path": {"type": "string", "pattern": "^(?!/)(?![A-Za-z]:)(?!.*://)(?!.*\\\\)(?!\\.?\\.?(?:/|$))(?!.*(?:/\\.?\\.?)(?:/|$))[^/]+(?:/[^/]+)*$"},
              "pass_criteria": {"type": "object", "minProperties": 1}
            }
          }
        }
      }
    },
    "lineage": {
      "type": "object",
      "additionalProperties": false,
      "required": ["parent_job_ids", "source_manifests", "prior_validation_receipts"],
      "properties": {
        "parent_job_ids": {"type": "array", "items": {"type": "string", "minLength": 1}},
        "source_manifests": {"type": "array", "items": {"type": "string", "pattern": "^(?!/)(?![A-Za-z]:)(?!.*://)(?!.*\\\\)(?!\\.?\\.?(?:/|$))(?!.*(?:/\\.?\\.?)(?:/|$))[^/]+(?:/[^/]+)*$"}},
        "prior_validation_receipts": {"type": "array", "items": {"type": "string", "pattern": "^(?!/)(?![A-Za-z]:)(?!.*://)(?!.*\\\\)(?!\\.?\\.?(?:/|$))(?!.*(?:/\\.?\\.?)(?:/|$))[^/]+(?:/[^/]+)*$"}}
      }
    },
    "contribution": {
      "type": "object",
      "additionalProperties": false,
      "required": ["creator_node_id", "executor_node_id", "produced_artifacts"],
      "properties": {
        "creator_node_id": {"type": "string", "minLength": 1},
        "executor_node_id": {"type": ["string", "null"], "minLength": 1},
        "produced_artifacts": {"type": "array", "items": {"type": "string", "pattern": "^(?!/)(?![A-Za-z]:)(?!.*://)(?!.*\\\\)(?!\\.?\\.?(?:/|$))(?!.*(?:/\\.?\\.?)(?:/|$))[^/]+(?:/[^/]+)*$"}}
      }
    }
  },
  "x-aethermesh-schema-version": "1.0.0"
}
